{
  "schema_version": 1,
  "id": "quality-regression",
  "name": "Quality Regression",
  "version": "0.1.0",
  "summary": "Blueprint route for CI, lint, typecheck, test, coverage, and regression repair tasks.",
  "agentplane": {
    "min_version": "0.5.0-rc.1",
    "blueprint_schema_version": 1
  },
  "definition": {
    "id": "quality.regression",
    "path": "blueprints/quality.regression.json"
  },
  "policy": ["policy/quality-regression.md"],
  "evidence_templates": ["evidence-templates/quality-regression.md"],
  "activation": {
    "mode": "explicit_only",
    "recommended_allowed_ids": ["quality.regression"]
  },
  "tags": ["quality", "ci", "testing", "coverage"]
}
